No.,Program,Category,Career Levels,Audience,Location,Career Planning,Employability & Applications,Leadership & Professorship,Mentoring,Coaching & Consultation,Mental Health Support,Work–Life & Family Support,Academic Writing,Communication & Presentation,Research Skills & Methods,Peer Learning,Travel & Mobility Funding,"Project, Completion & Bridge Funding",Event Funding,Awards & Recognition,Networking & Research Communities,International Onboarding & Administration,Language & Intercultural Skills,Anti-Discrimination & Equal Opportunity,Description
54,Open Access (OA),Funding,Postdoc,International researchers,Gießen,0,0,0,0,0,0,0,0,0,0,0,0,0,0,0,0,0,0,0,
55,From abroad to JLU,International Support & Visa,Postdoc,All researchers,Gießen,1,0,0,0,0,0,0,0,0,0,0,0,0,0,0,1,1,1,0,"This service provides international postdocs with comprehensive information and resources to prepare for and navigate their research stay at JLU. It combines practical guidance on administrative processes and daily life with access to structured information platforms, funding databases, and career resources at national level. Complementary offers such as excursions and language courses support social integration and facilitate orientation within the German research system."
56,Career in Science,Career Development,Postdoc,All researchers,Gießen,0,0,0,0,0,0,0,0,0,0,0,0,0,0,0,0,0,0,0,NA
57,Career beyond science,Career Development,Postdoc,All researchers,Gießen,0,0,0,0,0,0,0,0,0,0,0,0,0,0,0,0,0,0,0,NA
58,Funding for student assistants to support parents,Funding,Postdoc,All researchers,Gießen,0,0,0,0,0,0,0,0,0,0,0,0,0,0,0,0,0,0,0,NA
59,Travel Expense Fund for Business Trips with Children,Funding,Postdoc,All researchers,Gießen,0,0,0,0,0,0,1,0,0,0,0,1,0,0,0,0,0,0,0,The Travel Fund for Business Trips with Children provides financial support for researchers who need to travel with children under 14 due to a lack of on-site childcare. It enables the inclusion of accompanying persons and reduces structural barriers to mobility for researchers with caregiving responsibilities. The program promotes family-friendly research conditions by facilitating participation in professional travel and academic activities.
60,Fund to subsidize additional child care costs,Funding,Postdoc,All researchers,Gießen,0,0,0,0,0,0,1,0,0,0,0,0,0,0,0,0,0,0,0,"The Childcare Support Fund provides financial assistance for additional childcare needs arising outside regular care arrangements, such as during peak workload phases, school holidays, or unexpected disruptions. It targets postdocs and tenure-track professors with caregiving responsibilities and reduces barriers to sustained research productivity. The program strengthens family-friendly working conditions by enabling flexible responses to short-term care demands."
61,Counselling for discrimination issues,Mentoring & Wellbeing,Postdoc,All researchers,Gießen,0,0,0,0,1,0,0,0,0,0,0,0,0,0,0,0,0,0,1,"Anti-Discrimination Counselling provides confidential, independent support for individuals who have experienced or observed discrimination or seek clarification of such situations. In a protected setting, participants can reflect on their experiences, explore options for action, and define next steps with full autonomy. The service is solution- and resource-oriented, offers anonymity if desired, and can facilitate mediation or referral to further support structures."
62,"PCMO ""Academic Career"" Mentoring Program",Mentoring & Wellbeing,Postdoc,International researchers,Marburg,1,0,0,1,0,0,0,0,0,0,0,0,0,0,0,1,0,0,0,"The Cross-Mentoring Program “Academic Career” connects postdoctoral researchers with experienced academics from partner universities to support strategic career development in academia. Through a structured mentoring relationship complemented by workshops, networking events, and expert sessions, participants expand their professional networks and reflect on next career steps. The one-year program combines individualized guidance with cohort-based learning and cross-institutional exchange."
63,"PCMO ""Academic Career"" Mentoring Program",Mentoring & Wellbeing,Postdoc,All researchers,Gießen,1,0,0,1,0,0,0,0,0,0,0,0,0,0,0,1,0,0,0,"The Cross-Mentoring Program “Academic Career” connects postdoctoral researchers with experienced academics from partner universities to support strategic career development in academia. Through a structured mentoring relationship complemented by workshops, networking events, and expert sessions, participants expand their professional networks and reflect on next career steps. The one-year program combines individualized guidance with cohort-based learning and cross-institutional exchange."
64,Family Service of Marburg University,Family & Career,ECR,All researchers,Marburg,0,0,0,0,0,0,1,0,0,0,0,0,0,0,0,0,0,0,0,"The Family Service provides tailored support for students and researchers to balance academic or professional responsibilities with family life. It offers guidance on managing diverse caregiving responsibilities across different life stages, including childcare and care for relatives. The service enables sustainable work-life integration through individualized advice and practical solutions."
65,Mental Health Supportgroup for internationals,Mentoring & Wellbeing,PhD,All researchers,Marburg,0,0,0,0,0,1,0,0,0,0,1,0,0,0,0,1,0,0,0,"The Peer Support Group offers a regular, facilitated exchange space for international researchers to share experiences and address psychological challenges such as stress, loneliness, or homesickness. In a confidential and supportive online setting, participants engage in mutual support, peer learning, and network building. The format provides continuity through recurring sessions and strengthens well-being and social connectedness."
66,Equality Grant,Funding,ECR,All researchers,Darmstadt,1,0,0,0,0,0,1,0,0,0,0,0,0,0,0,0,0,0,1,"This support service addresses structural challenges faced by doctoral candidates and postdocs in balancing academic careers with family responsibilities or physical impairments. It provides targeted guidance and measures to navigate conditions such as fixed-term contracts, mobility requirements, and irregular working hours. The format strengthens equal opportunity by enabling sustainable career development under diverse personal circumstances."
67,Career Bridging Grant,Funding,ECR,All researchers,Darmstadt,0,0,0,0,0,0,0,0,0,0,0,0,0,0,0,0,0,0,0,NA
68,Formation of research groups or networks,Funding,Postdoc,All researchers,Darmstadt,0,0,0,0,0,0,0,0,0,0,0,0,1,0,0,1,0,0,0,Financial support for the formation and/or preparation of cross-university and/or interdisciplinary research groups and networks
69,Organisation of scientific conferences / workshops,Funding,Postdoc,All researchers,Darmstadt,0,0,0,0,0,0,0,0,0,0,0,0,0,1,0,0,0,0,0,Financial support for the organisation of scientific conferences / workshops (the conference must either be organised by a postdoc or explicitly address early career researchers)
70,Special teaching and research purposes,Funding,Postdoc,All researchers,Darmstadt,0,0,0,0,0,0,0,0,0,1,0,0,1,0,0,0,0,0,0,"Financial support for special research and teaching situations, such as the preparation of own risky or interdisciplinary research ideas, the organisation of special teaching formats, etc."
71,Individual Coaching,Funding,Postdoc,All researchers,Darmstadt,1,1,0,0,1,0,0,0,1,0,0,0,0,0,0,0,0,0,0,"Financial support for individual coaching/counselling (career coaching, pitch training, self-marketing)"
72,Coaching Offers,Mentoring & Wellbeing,ECR,All researchers,Darmstadt,1,0,0,0,1,0,0,0,0,0,0,0,0,0,0,0,0,0,0,"Coaching provides individualized support for researchers to reflect on professional situations, clarify goals, and develop effective courses of action. Guided by a professional coach, participants build on their own resources and strengths to navigate challenges and make informed decisions. The format enables structured reflection, goal-oriented development, and sustainable advancement in complex career contexts."
73,Goethe Welcome Centre,International Support & Visa,ECR,All researchers,Frankfurt,0,0,0,0,0,0,1,0,0,0,0,0,0,0,0,0,1,0,0,"The International Scholar Support Service provides comprehensive advisory and practical assistance for international researchers and doctoral candidates throughout all stages of their stay. It covers administrative, legal, and everyday matters such as visa and residence regulations, accommodation, insurance, taxation, and family-related support. The service ensures a smooth transition and enables effective integration into the academic and local environment."
74,Visual Neuroscience Summer School - thematically Focused Summer School 2026,Training,ECR,,Rauischholzhausen,0,0,0,0,0,0,0,0,0,1,0,1,0,0,0,0,0,0,1,"Thematically focused summer schools open to international top talent. Selection by the steering committee based on predefined criteria, including EDI goals. Travel stipends provided, including for scientists from LMICs."
75,Bi-weekly Colloquia,Networking,ECR,,all sites,0,0,0,0,0,0,0,0,0,1,1,0,0,0,0,0,0,0,0,Journal clubs organised by ECRs and logistically supported by the TrainingHub coordination office.
76,Ad hoc Journal Clubs,Networking,ECR,,all sites,0,0,0,0,0,0,0,0,0,1,1,0,0,0,0,1,0,0,0,"The Ad Hoc Journal Club is a flexible, participant-driven format for discussing current research publications in an informal and interdisciplinary setting. Sessions are organized on demand around selected papers, enabling timely engagement with emerging topics and methods. The format fosters critical thinking, scientific exchange, and spontaneous collaboration across research areas."
77,International for Research Secondments and Training (Outgoing),Networking,ECR,,all sites,0,0,0,0,0,0,0,0,0,1,0,1,0,0,0,0,0,1,0,"Large-scale international visits and exchange programme enabling ECRs to perform research stays in host labs worldwide, acquire new scientific skills and intercultural competencies."
78,International for Research Secondments and Training (Incoming),Networking,ECR,,all sites,0,0,0,0,0,0,0,0,0,0,0,1,0,0,0,1,1,0,0,Bidirectional exchange allowing international researchers to join TAM labs. Includes integration into TAM structures.
79,"Onboarding & Integration Support (New TAM members, Incoming ECRs from Exchange Program)",International Support & Visa,ECR,,all sites,0,0,0,0,0,0,0,0,0,0,0,0,0,0,0,0,1,0,0,"International offices, welcome centres and graduate centres provide structural support for orientation and integration into TAM and host institutions."
80,Buddy System,International Support & Visa,ECR,,all sites,0,0,0,0,0,0,0,0,0,0,1,0,0,0,0,1,1,1,0,Each incoming researcher may be supported by a member of a TAM host group who assists with everyday tasks outside research work and supports social integration.
81,Master Student Stipends,Funding,Master,,all sites,1,0,0,0,0,0,0,0,0,1,0,0,0,0,0,1,0,0,0,Supports Master students to engage in TAM-related research early in their career trajectory and integrate into the cluster environment.
82,Annual Treasure Box Competition,Funding,PhD,,all sites,0,0,0,0,0,0,0,0,0,0,0,0,1,0,0,0,0,0,0,Competitive funding instrument for short research proposals by doctoral researchers. Designed to foster independence and innovative project ideas.
83,Intramural Funding,Funding,Postdoc,,all sites,0,0,0,0,0,0,0,0,0,1,0,0,1,0,0,1,0,0,0,Supports postdoctoral researchers in enhancing research independence. Projects must address core TAM research questions and are encouraged to embrace interdisciplinary and collaborative approaches.
84,Start-up Bridge Funding,Funding,Postdoc,,all sites,0,0,0,0,0,0,0,1,0,0,0,1,1,0,0,0,0,0,0,"Bridge funding to span significant gaps in financial support. Enables postdocs to finalise manuscripts and prepare grant applications to secure independent funding. be used for research secondments in potential future labs, attending conferences, workshops, etc."