No.,Program,Category,Career Levels,Audience,Location,Career Planning,Employability & Applications,Leadership & Professorship,Mentoring,Coaching & Consultation,Mental Health Support,Work–Life & Family Support,Academic Writing,Communication & Presentation,Research Skills & Methods,Peer Learning,Travel & Mobility Funding,"Project, Completion & Bridge Funding",Event Funding,Awards & Recognition,Networking & Research Communities,International Onboarding & Administration,Language & Intercultural Skills,Anti-Discrimination & Equal Opportunity,Description
1,"Career Talks, Application Training, Leadership skills, ",Career Development,ECR,All researchers,Gießen,0,0,0,0,0,0,0,0,0,0,0,0,0,0,0,0,0,0,0,NA
2,Career Development for Postdocs,Career Development,Postdoc,Women researchers,Marburg,1,0,1,0,0,0,0,0,0,0,0,0,0,0,0,1,0,0,0,"The Postdoctoral Career Development Program is a structured, cross-institutional training initiative supporting postdocs in strategic career decision-making and progression toward leadership roles in academia. Through a modular series of workshops, seminars, and lectures, the program covers career planning, funding strategies, personnel management, and preparation for professorship. It combines orientation for diverse career paths with targeted training for those pursuing an academic trajectory and fosters inter-university exchange."
3,EXPLORA Network,Networking,PhD,All researchers,Gießen,0,0,0,0,0,0,0,0,0,1,0,0,0,0,0,1,0,0,0,"EXPLORA is an interdisciplinary research and training program investigating the mechanisms and impact of active exploration in human perception and behavior. Combining approaches from science, engineering, design, and the arts, it generates empirical insights and fosters innovation in areas such as immersive technologies, AI, and human–machine interaction. The program integrates research, training, and cross-sectoral collaboration across educational levels, from schools to doctoral training, to create broad scientific and societal impact."
4,German Postdoc Network,Networking,Postdoc,All researchers,Munich,0,0,0,0,0,0,0,0,0,0,1,0,0,0,0,1,0,0,0,"This platform aims to enhance the postdoctoral experience by fostering connection, collaboration, and a shared professional identity across disciplines and institutions. It provides access to relevant information and resources while creating structures for exchange and mutual support. In addition, it represents postdoctoral interests and contributes to shaping policies that affect their career development and working conditions."
5,"Center for Mind, Brain and Behavior",Career Development,ECR,All researchers,Marburg,0,0,0,0,0,0,0,0,0,0,0,0,0,0,0,0,0,0,0,NA
6,"FIT-Netzwerk (Forschung, Internationales und Transfer-Netzwerk)",Career Development,ECR,All researchers,Kassel,0,0,0,0,0,0,0,0,0,0,0,0,0,0,0,0,0,0,0,NA
7,German language course,Community & Integration,PhD,All researchers,Gießen,0,0,0,0,0,0,0,0,0,0,0,0,0,0,0,0,0,0,0,NA
8,Thesis writing support,Career Development,PhD,Women researchers,Gießen,0,0,0,0,0,0,0,0,0,0,0,0,0,0,0,0,0,0,0,NA
9,"Kaffeekränzchen for International Researchers, Doctoral Candidates and Postdocs",Community & Integration,ECR,All researchers,Gießen,0,0,0,0,0,0,0,0,1,0,1,0,0,0,0,0,0,1,0,"The German Language Coffee Meeting is a regular, informal exchange format for international researchers to practice and improve their German language skills. Held online every two weeks, it provides a low-threshold environment for conversation, peer interaction, and language development at an intermediate level. The format strengthens integration and communication skills within the academic context."
10,Virtual International Programme of JLU,International Support & Visa,ECR,All researchers,Gießen,0,0,0,0,0,0,1,0,0,0,0,0,0,0,0,0,1,0,0,"The International Researcher Support Service provides comprehensive guidance for international researchers and host institutions on administrative and organizational aspects of research stays. It covers key areas such as visa and entry procedures, accommodation, funding opportunities, and family-related matters, including schooling and childcare. The service facilitates a smooth onboarding process and supports effective integration into the academic and local environment."
11,Giessen Graduate Center for Natural Sciences & Psychology (GGN),Career Development,ECR,All researchers,Gießen,0,0,0,0,0,0,0,0,0,0,0,0,0,0,0,0,0,0,0,NA
12,Communication Skills,Career Development,ECR,All researchers,Gießen,0,0,0,0,0,0,0,0,0,0,0,0,0,0,0,0,0,0,0,NA
13,Mentoring Hessen – Women in Sciences,Mentoring & Wellbeing,ECR,International researchers,Hessen,1,0,0,1,0,0,0,0,0,0,1,0,0,0,0,1,0,0,1,"This program supports early-career women through a structured combination of mentoring, training, and networking across key career stages. It integrates one-to-one mentoring with peer group formats, complemented by targeted workshops on career strategies, soft skills, and professional development. The format strengthens career progression, builds networks, and promotes gender equity in academia."
14,offers supporting mental health,Mentoring & Wellbeing,Postdoc,All researchers,Gießen,0,0,0,0,0,1,0,0,0,0,0,0,0,0,0,0,0,0,0,"This format raises awareness of mental health challenges in academia and provides orientation on structural and individual factors affecting well-being. It combines information, reflection, and signposting to specialized initiatives, resources, and support services for researchers. The format enables informed engagement with topics such as stress, anxiety, and systemic pressures, and promotes proactive strategies for maintaining mental health in academic careers."
15,Program for Doctoral Candidates,Career Development,PhD,All researchers,Marburg,1,1,0,0,0,0,0,1,1,1,0,0,0,0,0,0,0,0,0,"The Doctoral Training Program provides a structured, interdisciplinary qualification framework for doctoral candidates, combining transferable skills training with discipline-specific elements across the sciences, humanities, and social sciences. Through courses, workshops, and complementary advisory services, the program supports both academic development and career preparation within and beyond academia. It integrates targeted offers for international researchers and maintains a strong focus on academic writing and communication competencies."
16,Travel Assistance,Funding,ECR,All researchers,Marburg,0,0,0,0,0,0,0,0,0,0,0,1,0,0,0,0,0,0,0,"Travel Grants provide financial support for doctoral candidates and postdocs to undertake research-related travel, including conferences, fieldwork, and archive visits. The program targets situations where no alternative funding sources are available and enables participation in key academic activities. Due to limited resources, funding is allocated competitively based on defined eligibility and selection criteria."
17,Conference Organization,Funding,ECR,All researchers,Marburg,0,0,0,0,0,0,0,0,0,0,0,0,0,1,0,0,0,0,0,"Event Funding supports doctoral candidates and postdocs in organizing academic events such as conferences, colloquia, and lecture series at the university. The program provides targeted financial contributions to strengthen scholarly exchange, visibility, and initiative, with a particular focus on supporting self-organized academic groups. It explicitly funds institutional event formats rather than individual travel to external conferences."
18,Doctoral completion Scholarships from Philipps-Universität Marburg,Funding,PhD,International researchers,Marburg,0,0,0,0,0,0,0,0,0,0,0,0,1,0,0,0,0,0,0,The doctoral completion scholarships are intended to support particularly qualified doctoral candidates in completing their qualification work if no other funding is available.
19,Habilitation Completion Scholarships,Funding,Postdoc,All researchers,Marburg,0,0,1,0,0,0,0,0,0,0,0,0,1,0,0,0,0,0,1,"The Habilitation Completion Grant provides targeted financial support for highly qualified female postdoctoral researchers to finalize their habilitation projects. Funded through the federal and state programme for female professors, the initiative aims to strengthen the representation of women on the path to professorship and promote long-term integration into academia. The program enables focused completion of qualification work in cases where no alternative funding is available and is coordinated in collaboration with equal opportunities structures."
20,Student Assistant-Fund to Support Doctoral Students and Postdocs at Philipps-Universität Marburg,Funding,ECR,International researchers,Marburg,0,0,0,0,0,0,1,0,0,0,0,0,0,0,0,0,0,0,1,"The Student Assistant Fund provides targeted financial support for doctoral candidates and postdocs with caregiving responsibilities to sustain their research activities. It enables the hiring of a student assistant for a defined period, reducing workload pressures and creating capacity for focused research. The program strengthens equal opportunity by mitigating structural disadvantages related to family commitments and supporting continuity in academic careers."
21,PhD/Postdoc Meeting,Networking,ECR,All researchers,Marburg,0,0,0,0,0,0,0,0,0,0,1,0,0,0,0,1,0,0,0,"The annual meeting offers doctoral candidates and postdocs the opportunity to network across disciplines. In a relaxed atmosphere, the participants can expand their skillset and exchange ideas – about their research topics, but also about everyday life as academics in the qualification phase. Please check out their website for upcoming dates."
22,Scientist's day,Networking,ECR,All researchers,Marburg,1,0,0,0,0,0,0,0,0,0,1,0,0,0,0,1,0,0,0,"Scientists’ Day is a thematic career event that brings together early-career researchers to reflect on key structural and personal dimensions of academic career development. Focusing on topics such as timing, career transitions, and the alignment of professional and personal decisions, the event creates a space for critical discussion and shared learning. Through talks and exchange formats, participants gain strategic insights into navigating academic career paths under conditions of uncertainty and time pressure."
23,Academic Groups,Networking,ECR,All researchers,Marburg,0,0,0,0,0,0,0,0,0,0,1,0,0,0,0,1,0,0,0,"Academic Groups are self-organized, topic-focused peer networks in which researchers collaborate, exchange ideas, and support each other’s work. Supported by MARA, these interdisciplinary groups create flexible spaces for regular meetings, colloquia, or workshops tailored to their specific interests. The format fosters initiative, cross-disciplinary collaboration, and sustained scholarly exchange."
24,Marburg “Welcome Walk” (City Tour),Community & Integration,ECR,All researchers,Marburg,0,0,0,0,0,0,0,0,0,0,1,0,0,0,0,1,0,0,0,"During the Welcome Walk, you will get to know other people who are doing their doctorate, working as postdocs and researching at Philipps-Universität, as well as central facilities, important support services and secret corners. We stroll through the Lahntal and conquer the Lahnberge … every now and then."
25,Individual Career Consultation,Career Development,ECR,All researchers,Marburg,1,1,0,0,1,0,0,0,0,0,0,0,0,0,0,0,0,0,0,"Individual Career Consultation offers tailored advisory sessions for doctoral candidates and postdocs to reflect on key decisions across the doctoral and postdoctoral phases. The format supports informed decision-making on topics such as pursuing a doctorate, funding strategies, career paths within and beyond academia, and targeted skill development. It provides a confidential setting to address individual challenges and define clear next steps in career progression."
26,Individual Writing Consultation,Mentoring & Wellbeing,PhD,All researchers,Marburg,0,0,0,0,0,0,0,1,1,0,0,0,0,0,0,0,0,0,0,"Writing Consultation offers individual support for doctoral candidates to develop and refine their academic writing in German or English. In confidential sessions, participants receive guidance on all stages of the writing process, including structuring arguments, managing literature, and improving writing efficiency. The format strengthens writing competence, enhances clarity and coherence of texts, and builds confidence in academic communication."
27,Individual Coaching,Mentoring & Wellbeing,ECR,All researchers,Marburg,1,0,1,0,1,0,0,0,1,0,0,0,0,0,0,0,0,0,0,"Individual Coaching provides tailored one-to-one support for advanced doctoral candidates and postdocs on key topics such as career planning, doctoral progress, grant applications, and leadership in research. Based on an initial needs assessment, participants are matched with experienced coaches and receive funded coaching sessions focused on their specific development goals. The format enables targeted skill development in areas such as academic communication, funding strategy, and career decision-making."
28,Collegial Consultation,Mentoring & Wellbeing,ECR,All researchers,Marburg,1,0,1,0,1,0,0,0,0,0,1,0,0,0,0,0,0,0,0,"Collegial Consultation is a peer-coaching format in which early-career researchers systematically advise each other on professional challenges in a confidential and trust-based setting. Guided by an experienced coach, small interdisciplinary groups develop practical solutions to issues such as career planning, team dynamics, or work organization while strengthening their reflective and leadership skills. The program aims to establish self-sustaining peer consultation groups that continue beyond the initial facilitated sessions."
29,Welcome Center,International Support & Visa,ECR,All researchers,Marburg,0,0,0,0,0,0,0,0,0,0,0,0,0,0,0,0,1,1,0,"The Welcome Center provides comprehensive support for international researchers before and during their stay, covering administrative processes such as visa, residence, and employment formalities. It facilitates a smooth transition by offering guidance on relocation, as well as social and cultural integration into the local environment. In addition, the service advises hosting departments to ensure well-coordinated onboarding of international guests."
30,Psychotherapeutic Counselling Centre for Students (PBS),Mentoring & Wellbeing,PhD,All researchers,Marburg,0,0,0,0,0,1,0,0,0,0,0,0,0,0,0,0,0,0,0,"The Psychotherapeutic Counselling Centre for Students (PBS) provides professional psychological support for a wide range of study-related and personal challenges, including stress, conflicts, and mental health concerns. Consultations are confidential, anonymous, and available in German and English, offered in person, by phone, or via secure video sessions. The service enables early intervention, offers clinical expertise, and facilitates referral to specialized care when needed."
31,Welcome Centre for International Scholars and Scientists,International Support & Visa,ECR,All researchers,Darmstadt,0,0,0,0,0,0,1,0,0,0,0,0,0,0,0,0,1,0,0,"The Welcome Centre for International Researchers at TU Darmstadt provides tailored advisory and practical support for international researchers, staff, and their families throughout the relocation and onboarding process. It covers key administrative and organizational aspects such as visa procedures, documentation, contracts, and accommodation. The service ensures a well-prepared start and facilitates sustainable integration into the academic and local environment."
32,Supporting programm for PhD,Career Development,PhD,All researchers,Darmstadt,1,1,0,0,0,0,0,0,0,0,0,0,0,0,0,0,0,0,0,"Career Support for Doctoral Candidates provides tailored guidance and development opportunities to support individual career planning across academia, industry, and society. Building on a strong research environment, the format offers targeted measures to help doctoral researchers identify career options and develop relevant competencies. It enables informed career decisions and strategic positioning for diverse professional pathways."
33,Supporting programm for Postdocs,Career Development,Postdoc,All researchers,Darmstadt,1,1,0,0,0,0,0,0,0,0,0,0,0,0,0,1,0,0,0,"Ingenium serves as the central platform for early career researcher development at TU Darmstadt, providing information, guidance, and support across academic and non-academic career paths. As a single point of contact, it offers a structured professional skills program alongside regular career and networking events. The format ensures coordinated, university-wide support and enhances visibility of development opportunities."
34,Supporting programm for ECR,Career Development,ECR,All researchers,Darmstadt,1,1,1,0,0,0,0,0,0,1,0,0,0,0,0,0,0,0,0,"The Early Career Researcher Development Framework at TU Darmstadt provides a structured, phase-oriented support system spanning doctoral, postdoctoral, and professorial qualification stages. Through a dual approach combining a central umbrella organization (Ingenium) with discipline-specific programs, it ensures consistent standards, tailored training, and transparent career development pathways. The framework creates optimal conditions for academic and non-academic career progression while fostering institutional coherence in researcher development."
35,Psychotherapeutic Counseling Center (PBS),Mentoring & Wellbeing,PhD,All researchers,Darmstadt,0,0,0,0,0,1,0,0,0,0,0,0,0,0,0,0,0,0,0,"Psychological Counselling for Students provides professional support for a broad range of emotional, academic, and personal challenges, including anxiety, stress, self-doubt, and relationship issues. The service offers confidential consultations to help students reflect on their situation, develop coping strategies, and stabilize their well-being. It strengthens students’ capacity to manage study demands and make informed decisions about their academic and personal development."
36,TU Darmstadt Counselling Services for employees,Mentoring & Wellbeing,Postdoc,All researchers,Darmstadt,0,0,0,0,1,1,0,0,0,0,0,0,0,0,0,0,0,0,0,"The Employee Counselling Service provides confidential, independent support for staff facing professional, personal, or social challenges, including workplace conflicts, stress, and major life transitions. Through solution-oriented consultations, it helps individuals clarify situations, develop new perspectives, and identify appropriate courses of action. The service also offers guidance on additional support options and contributes to sustainable well-being and effective functioning in the workplace."
37,Intercultural Affairs,Community & Integration,ECR,All researchers,Darmstadt,0,0,0,0,0,0,0,0,0,0,0,0,0,0,0,1,1,1,0,"Intercultural Affairs offers a comprehensive program of events, workshops, and advisory services to support integration and intercultural competence within the university community. It facilitates networking between international and local participants while providing orientation on studying and living in Darmstadt. The format promotes inclusive exchange, cultural understanding, and active engagement across diverse groups."
38,GRADE Goethe Research Academy for Early Career Researcher,Career Development,ECR,International researchers,Frankfurt,0,0,0,0,0,0,0,0,0,0,0,0,0,0,0,0,0,0,0,NA
39,Social Welcoming Tour,Community & Integration,ECR,International researchers,Frankfurt,0,0,0,0,0,0,0,0,0,0,1,0,0,0,0,1,0,1,0,"Social Welcoming Events are interdisciplinary networking formats that combine cultural excursions with informal exchange among doctoral candidates and postdocs across the Rhine-Main University Alliance. The events provide opportunities to explore regional culture and history while building professional and social connections in an international environment. By integrating guided visits with informal networking, the format strengthens community building and cross-institutional exchange."
40,Individual Coaching,Mentoring & Wellbeing,ECR,All researchers,Frankfurt,1,0,0,0,1,0,1,0,0,0,0,0,0,0,0,0,0,0,0,"Individual Coaching (GRADE) offers structured, free one-to-one coaching sessions for doctoral candidates and postdocs to support key transition phases, decision-making, and challenging situations. Across a defined number of sessions per career stage, participants address topics such as self-management, career orientation, conflict resolution, and work-life balance in a confidential setting. The format enables targeted reflection, problem-solving, and strategic positioning throughout the academic career trajectory."
41,Individual Career Advice,Mentoring & Wellbeing,ECR,All researchers,Frankfurt,1,1,0,0,1,0,0,0,0,0,0,0,0,0,0,0,0,0,0,"Individual Career Advice (GRADE) provides confidential, one-to-one guidance for doctoral candidates and postdocs to clarify their professional orientation and next career steps. The format supports self-assessment of skills, strengths, values, and motivations, enabling informed decision-making and strategic career planning. Tailored consultations focus on developing concrete career options and defining actionable development pathways."
42,"GGN Meets Industry ""Career in Industry""",Career Development,ECR,All researchers,Gießen,0,0,0,0,0,0,0,0,0,0,0,0,0,0,0,0,0,0,0,NA
43,Meet the Expert - Contact,Career Development,ECR,All researchers,Gießen,1,0,0,0,0,0,0,0,0,0,0,0,0,0,0,1,0,0,0,"Meet the Experts is a flexible event format that brings early-career researchers into direct exchange with invited experts from academia and related sectors. Through talks and interactive discussions, participants gain insights into career paths, research topics, and professional development strategies. The format is demand-driven, allowing ECRs to propose experts and shape the thematic focus."
44,Family&career,Family & Career,ECR,International researchers,Gießen,0,0,0,0,0,0,0,0,0,0,0,0,0,0,0,0,0,0,0,NA
45,Travel funding,Funding,ECR,All researchers,Gießen,0,0,0,0,0,0,0,0,0,0,0,1,0,0,0,0,0,0,0,"Travel Grants for Scientific Events provide financial support for early-career researchers to present their work at conferences, symposia, and related academic events. The program enables participation in key networking and knowledge exchange opportunities when alternative funding is unavailable, covering part of the travel costs. Funding is allocated competitively based on defined criteria and supports the international visibility and professional development of researchers."
46,GGN EARLY CAREER AWARD for outstanding achievements in the natural sciences,Funding,ECR,All researchers,Gießen,0,0,0,0,0,0,0,0,0,0,0,0,0,0,1,0,0,0,0,"The GGN Early Career Award recognizes outstanding achievements of early-career researchers in the natural sciences and supports their continued development through a monetary prize. It honors excellence in research, teaching, and societal engagement, as well as innovative doctoral work with significant disciplinary impact. The competitive award enhances visibility, acknowledges academic merit, and incentivizes high-quality contributions across multiple dimensions of scientific activity."
47,Dr.-Herbert-Stolzenberg-Award,Funding,ECR,All researchers,Gießen,0,0,0,0,0,0,0,0,0,0,0,0,0,0,1,0,0,0,0,"The Dr.-Herbert-Stolzenberg Award recognizes outstanding achievements of early-career researchers in the natural sciences and supports their academic development through a monetary prize. It honors excellence in research performance and exceptional commitment to the discipline at an early career stage. The award enhances visibility, acknowledges scientific merit, and incentivizes continued high-level contributions."
48,Call for Proposals - Organize your own workshop,Funding,ECR,All researchers,Gießen,0,0,0,0,0,0,0,0,0,0,0,0,0,0,0,0,0,0,0,NA
49,Career Preparation for international students,Career Development,ECR,All researchers,Gießen,1,1,0,0,1,0,0,0,1,0,0,0,0,0,0,0,1,0,0,"Career Preparation for International Students provides targeted guidance and resources to support international students and early-career researchers in entering the German job market. The program combines career counselling, application training, legal orientation, and curated events with practical tools such as alumni insights and job market information. It enables structured career orientation, strengthens employability, and facilitates a successful transition from studies to professional careers."
50,Welcome & arrival Info,International Support & Visa,ECR,All researchers,Gießen,0,0,0,0,0,0,0,0,0,0,0,1,0,0,0,1,1,1,0,"JLU International defines the university’s strategic approach to internationalisation, combining global partnerships, regional focus areas, and institutional alliances. It encompasses international mobility, cooperation programs, and external representations, strengthening global engagement and visibility. The framework aligns international activities with institutional development goals, fostering an integrated and strategic approach to internationalisation."
51,Intercultural competences,Career Development,ECR,All researchers,Gießen,0,0,0,0,0,0,0,0,0,0,0,0,0,0,0,0,0,0,0,NA
52,Counselling,Mentoring & Wellbeing,PhD,All researchers,Gießen,0,0,0,0,1,1,0,0,0,0,0,0,0,0,0,0,0,0,0,"The Student Counselling Service provides confidential, free support for a wide range of academic and personal challenges, including study difficulties, stress, anxiety, and interpersonal issues. Through a limited number of tailored sessions, students receive professional guidance to clarify their situation, develop coping strategies, and identify solutions. The format offers a low-threshold entry point for early intervention and sustained well-being during studies."
53,Acute crisis hotlines,Mentoring & Wellbeing,ECR,All researchers,Gießen,0,0,0,0,0,1,0,0,0,0,0,0,0,0,0,0,0,0,0,"""Points of contact in acute crises, Sometimes it is urgent and you can not wait until our appointment, for example, suicidal thoughts. In this case, you can contact the following institutions day and night, including weekends:"""
